id,title,score,num_comments,author,created_utc,url,over_18,edited,spoiler,stickied
1gk1ofe,Data vault 2.0,45,42,Spoetastic,2024-11-05 07:54:23,https://www.reddit.com/r/dataengineering/comments/1gk1ofe/data_vault_20/,False,False,False,False
1gk5qxj,Is a date dimension table common,39,36,Wise-Ad-7492,2024-11-05 12:41:35,https://www.reddit.com/r/dataengineering/comments/1gk5qxj/is_a_date_dimension_table_common/,False,False,False,False
1gk16wo,DBT core + airflow vs. DBT cloud,36,35,Baklawwa,2024-11-05 07:17:02,https://www.reddit.com/r/dataengineering/comments/1gk16wo/dbt_core_airflow_vs_dbt_cloud/,False,False,False,False
1gk9moi,Portability principle: The path to vendor-agnostic Data Platforms,34,8,Thinker_Assignment,2024-11-05 15:43:14,https://www.reddit.com/r/dataengineering/comments/1gk9moi/portability_principle_the_path_to_vendoragnostic/,False,False,False,False
1gkcv0k,Favorite dbt features,24,25,AMDataLake,2024-11-05 17:58:37,https://www.reddit.com/r/dataengineering/comments/1gkcv0k/favorite_dbt_features/,False,False,False,False
1gk9r96,How to start to be a Freelancer data engineer ,16,5,Junior-Lavishness952,2024-11-05 15:48:39,https://www.reddit.com/r/dataengineering/comments/1gk9r96/how_to_start_to_be_a_freelancer_data_engineer/,False,False,False,False
1gkmldi,"If an opportunity is given to start fresh, what are the things that you would recommend to learn or the books to read ?",16,3,iceberg_1001,2024-11-06 01:05:25,https://www.reddit.com/r/dataengineering/comments/1gkmldi/if_an_opportunity_is_given_to_start_fresh_what/,False,False,False,False
1gk12y5,"Need guidance from Data Engineers in India at FAANG, Top PBCs and exciting startups",9,10,kufliraj,2024-11-05 07:08:45,https://www.reddit.com/r/dataengineering/comments/1gk12y5/need_guidance_from_data_engineers_in_india_at/,False,False,False,False
1gkhkb0,Orchestration Software that allows consumers to trigger ETL pipelines ,8,15,Robbyc13,2024-11-05 21:15:48,https://www.reddit.com/r/dataengineering/comments/1gkhkb0/orchestration_software_that_allows_consumers_to/,False,False,False,False
1gkf494,Column headers constantly keep changing position in my csv file,8,27,Django-Ninja,2024-11-05 19:31:51,https://www.reddit.com/r/dataengineering/comments/1gkf494/column_headers_constantly_keep_changing_position/,False,False,False,False
1gk1v61,Data Integration Book,5,1,Glittering_Leg4193,2024-11-05 08:08:29,https://www.reddit.com/r/dataengineering/comments/1gk1v61/data_integration_book/,False,False,False,False
1gkfegt,"Do you use database migration tools or do you let the pipeline (pandas, polars etc) create and update tables?",5,7,DeepFryEverything,2024-11-05 19:44:00,https://www.reddit.com/r/dataengineering/comments/1gkfegt/do_you_use_database_migration_tools_or_do_you_let/,False,False,False,False
1gk4aj0,dbt tips & tricks #3,4,1,Datafluent,2024-11-05 11:12:18,https://www.reddit.com/r/dataengineering/comments/1gk4aj0/dbt_tips_tricks_3/,False,False,False,False
1gk433z,Skills evaluation,2,2,Soggy_Award1213,2024-11-05 10:58:51,https://www.reddit.com/r/dataengineering/comments/1gk433z/skills_evaluation/,False,False,False,False
1gkrk5d,What do you guys think about drag and drop data pipelines?,3,5,itsawesomedude,2024-11-06 05:53:54,https://www.reddit.com/r/dataengineering/comments/1gkrk5d/what_do_you_guys_think_about_drag_and_drop_data/,False,False,False,False
1gkcv48,Software for large sets of data,1,15,Bblstar123,2024-11-05 17:58:44,https://www.reddit.com/r/dataengineering/comments/1gkcv48/software_for_large_sets_of_data/,False,False,False,False
1gk274a,I was Preparing for GCP EXAM and i got the Voucher from Google Skill Boost so which exam should go with???,3,1,Infamous_Working6597,2024-11-05 08:34:49,https://www.reddit.com/r/dataengineering/comments/1gk274a/i_was_preparing_for_gcp_exam_and_i_got_the/,False,False,False,False
1gkfdzo,Docker Airflow DEV environment on MacOS without WSL,3,6,Maekkar,2024-11-05 19:43:23,https://www.reddit.com/r/dataengineering/comments/1gkfdzo/docker_airflow_dev_environment_on_macos_without/,False,False,False,False
1gkbbji,Seeq real time data analytics platform,2,0,halim9696,2024-11-05 16:54:25,https://www.reddit.com/r/dataengineering/comments/1gkbbji/seeq_real_time_data_analytics_platform/,False,False,False,False
1gkaxws,We was created a utility library but i cant implement the idea to team,1,7,OtherAd3010,2024-11-05 16:38:30,https://www.reddit.com/r/dataengineering/comments/1gkaxws/we_was_created_a_utility_library_but_i_cant/,False,False,False,False
1gk132l,DataChain: DBT for Unstructured Data,2,0,dmpetrov,2024-11-05 07:09:01,https://github.com/iterative/datachain,False,False,False,False
1gkc5ia, Accumulating Snapshot Fact Table with one new row for each state change,1,3,Wise-Ad-7492,2024-11-05 17:28:46,https://www.reddit.com/r/dataengineering/comments/1gkc5ia/accumulating_snapshot_fact_table_with_one_new_row/,False,False,False,False
1gk9x3e,Building Snowflake Native AI App to improve your Company's Customer Experience?,1,1,Training_Theme6056,2024-11-05 15:55:32,https://www.reddit.com/r/dataengineering/comments/1gk9x3e/building_snowflake_native_ai_app_to_improve_your/,False,False,False,False
1gk8cnq,DataFlow Architecture,1,0,drc1728,2024-11-05 14:47:14,https://www.reddit.com/r/dataengineering/comments/1gk8cnq/dataflow_architecture/,False,False,False,False
1gk5zv2,renewable energy ideas,1,3,Less_Insurance_9788,2024-11-05 12:54:45,https://www.reddit.com/r/dataengineering/comments/1gk5zv2/renewable_energy_ideas/,False,False,False,False
1gk59kr,is there is any way to connect to meta to grab live analytics for marketing performance? ,1,1,MilkyJoey69,2024-11-05 12:14:26,https://www.reddit.com/r/dataengineering/comments/1gk59kr/is_there_is_any_way_to_connect_to_meta_to_grab/,False,False,False,False
1gk3bnk,Need Suggestions ,1,3,Suspicious-One-9296,2024-11-05 10:03:33,https://www.reddit.com/r/dataengineering/comments/1gk3bnk/need_suggestions/,False,False,False,False
1gk2q0t,How to handle Iceberg CommitFailedException after invoking rewrite_data_files procedure?,1,2,Snoo54963,2024-11-05 09:16:27,https://www.reddit.com/r/dataengineering/comments/1gk2q0t/how_to_handle_iceberg_commitfailedexception_after/,False,False,False,False
1gk2ilz,Thoughts on Orchestra lightweight pricing for dbt core,2,0,engineer_of-sorts,2024-11-05 09:00:11,https://www.reddit.com/r/dataengineering/comments/1gk2ilz/thoughts_on_orchestra_lightweight_pricing_for_dbt/,False,False,False,False
1gk0qoo,Little guides to this new entrance :),1,1,Perrit0Malvado,2024-11-05 06:44:12,https://www.reddit.com/r/dataengineering/comments/1gk0qoo/little_guides_to_this_new_entrance/,False,False,False,False
1gk8072,"drift.dev - Observe, Resolve and Optimize Flink Pipelines",0,0,coolabs,2024-11-05 14:31:07,https://www.reddit.com/r/dataengineering/comments/1gk8072/driftdev_observe_resolve_and_optimize_flink/,False,False,False,False
1gk92op,Do you use Copilot in your day-to-day? How?,0,9,Irachar,2024-11-05 15:19:13,https://www.reddit.com/r/dataengineering/comments/1gk92op/do_you_use_copilot_in_your_daytoday_how/,False,False,False,False
1gk149i,When AI will substitute us data engineers at work if so.,0,4,Disastrous-Cap8678,2024-11-05 07:11:35,https://www.reddit.com/r/dataengineering/comments/1gk149i/when_ai_will_substitute_us_data_engineers_at_work/,False,False,False,False
